
(In millions),,,,,,,,,
"Year Ended June 30,",,2024,,,2023,,,2022,
Beginning unrecognized tax benefits,,$,"17,120",,,$,"15,593",,,$,"14,550",
Decreases related to settlements,,,(76,),,,(329,),,,(317,)
Increases for tax positions related to the current year,,,"1,903",,,,"1,051",,,,"1,145",
Increases for tax positions related to prior years (a),,,"4,289",,,,870,,,,461,
Decreases for tax positions related to prior years,,,(464,),,,(60,),,,(246,)
Decreases due to lapsed statutes of limitations,,,(12,),,,(5,),,,0
Ending unrecognized tax benefits,,$,"22,760",,,$,"17,120",,,$,"15,593",
